{
  "$schema": "https://json-schema.org/draft/2020-12/schema",
  "$id": "https://flagship-foundry.local/schemas/guardrail-pack.schema.json",
  "title": "Guardrail Pack",
  "type": "object",
  "required": [
    "id",
    "name",
    "scope",
    "rules"
  ],
  "properties": {
    "id": {
      "type": "string"
    },
    "name": {
      "type": "string"
    },
    "scope": {
      "type": "string"
    },
    "rules": {
      "type": "array",
      "items": {
        "type": "string"
      }
    },
    "evidenceRequirements": {
      "type": "array",
      "items": {
        "type": "string"
      }
    }
  }
}
