{
  "$schema": "../schemas/guardrail-pack.schema.json",
  "id": "guardrail:workspace-governance",
  "name": "Workspace Governance",
  "scope": "all plans and runs",
  "rules": [
    "Artifacts and schemas outrank chat history.",
    "A plan is not complete until blast radius, verification, and handoff are explicit.",
    "Manual approval is the default unless an explicit auto-approval policy is set.",
    "Continuity state must be updated at every phase transition."
  ],
  "evidenceRequirements": [
    "plan record",
    "approval record",
    "continuity update"
  ]
}
